<!ELEMENT activeTimes (item+)>
<!ELEMENT item (start, stop, mode, descr)>
<!ELEMENT start (year, month, day, hour, minute, second)>
<!ELEMENT stop (year, month, day, hour, minute, second)>
<!ELEMENT year (#PCDATA)>
<!ELEMENT month (#PCDATA)>
<!ELEMENT day (#PCDATA)>
<!ELEMENT hour (#PCDATA)>
<!ELEMENT minute (#PCDATA)>
<!ELEMENT second (#PCDATA)>
<!ELEMENT mode (#PCDATA)>
<!ELEMENT descr (#PCDATA)>
